Review Text,Star
"I first visited Condado when they opened in Pittsburgh and was not impressed. This visit was much better! Meet some friends for happy hour. You can't beat the special here! Drinks: Extensive drink menu with so many margarita flavors. I had the blood orange and will have it again in the future! My friends had Blackberry and pomegranate, which were also very good. They even offer margarita flights to sample some of the flavors. Food: We had the usual chips and queso to start. Nothing special, but how can you not? Then we ordered tacos. They have a preset menu or you can build your own. I did a build-your-own with chorizo. Very good! I had the pulled chicken before and was not as impressed. The tacos are a generous size. Order two for a complete meal. The build-you-own menu offers a number of salsas/tortillas/meats/toppings - you can't go wrong! Space: Condado has two floors. We sat downstairs. Seating is tight! Just a heads up if that's not your thing... Super excited to make this a go to happy hour stop this summer!",4-star
"Most delicious tacos ever. You have to like spicy though because everything has a bite to it. Also, be prepared for a wait, especially if you have a larger group, but most definitely worth it.",4-star
"First things first, GET THE BRISKET, explanation below. I'm a big fan of Condado. IMO, it's a mix between fast food tacos and gourmet tacos. There's a ton of great options. I like building my own tacos and adding as much as I'd like. I highly recommend the brisket, it's extremely flavorful and not dry. Service is good, food comes out fast, and it's cheap compared to other tacos joints.",5-star
"Condado is hands down my favorite place to get tacos. The build your own menu offers a lot of unique and delicious choices. Along with that, the price is fantastic. The atmosphere is cool as well. Great customer service, great food, great drinks. Highly recommend!",5-star
"Mostly toppings and sauce. My stomach was left unhappy and my tongue was uninspired. For all of the complexity of their ingredients, they didn't mesh well. Nice bar staff, average food.",2-star
"I have been back to Condado a few times since my first visit when they first opened and I just don't feel they are living up to their original standard they set last year for me. While their food, in my opinion, is still good and their combinations creative/endless, my issue stands with their service. If I were rating based on service and the interaction I've had with employees alone, I'd give 2 stars and even that is being generous. I've been here 3-4 times with reservations and it's never been a simple process. I would think with such a large upstairs space and the fact that they promote brunch so heavily on the weekends, that they would expect the crowd that comes and not act like they're trying to keep their head above water taking care of customers. During any visit I've made recently, there were issues with the reservation not being communicated/tables not being set up, the service being slow/confusing/clustered or our food not coming out correctly. These are all relatively minor things to be resolved, but creates an irritating experience when they happen, especially on a repeated basis. The employees seem to be there more to interact with each other and socialize than to actually do their job. This past weekend we had a large party for my birthday and while our waitress was doing the best she could, they set us up in this most misconstrued configuration of 3 tables all facing different direction and we had one person taking care of all of us ON TOP of her other tables upstairs. This caused a lot of confusion both for her and us and probably would have been helpful to have more hands on deck. Not to mention not one person at my table felt they actually received what they ordered, but that's not the waitress' fault. Overall I love the idea and the atmosphere (and the margs) at Condado, but there are definitely areas that need work. Seems fun & great for a group of people, but ends up being more frustrating and inconvenient, in my experience, once it's all said and done.",3-star
"We've heard good things about this place and were excited to try out a new taco joint hoping it was different than the other ten that are in town. We arrived and were quickly seated at a table that was far too small for two people. We only ordered drinks, chips and tacos but they didn't fit on our table. The service was slow and our server acted like she had better things to do. We waited over 20 minutes for our drinks and in that time we contemplated leaving. We stayed because we were so hungry and hoped anything we ordered would change our minds. We both ordered a few tacos including the surf and turf taco which we were told wasn't ready yet because he seviche wasn't prepared. It was happy hour, so assuming it was a busy time it should have been prepared. We didn't replace it with something else and quickly ate so we could get out of there. Maybe it was a bad day for our server or something but we wanted to love it based on the new twist it brought to tacos. We left and walked to Bakersfield down the street. We may be back if everything else is booked.",2-star
Heard such good things about this place I couldn't wait to try it! Go in and wait to be served...and waited..and waited. Finally grabbed my stuff and got up and left! Service sucks!,1-star
"We chose Condado as the dinner place for my husband's birthday with a couple of his friends because who doesn't love tacos?! We definitely were not disappointed. They don't take reservations so we walked in and the wait was long, but we didn't mind because there was a bar :) In fact, there are two! One downstair and one upstairs; the upstairs one seemed larger. So we left our name and went upstairs and ordered a pitcher of Strawberry Margaritas and their Traditional Jalapeno Guacamole. The pitcher served about 6 glasses and were perfect! Not to sugary or watered down like other places make, but not too strong with the taste of cheap tequila! You could taste both the mix and the alcohol = two thumbs up! The guac was great and smooth and their chips crispy. After who knows how long, we sat down and started our fun journey of building our own tacos with the check list. Two people in our party picked from their pre-selected tacos and the other four built their own. It building your own was overwhleming at first glance, but super exciting as I looked down the list. It is nice to be able to order two different tacos with two different flavor themes! I made one with the beef brisket and a spicy theme (using the other toppings) and the second one with the BBQ jackfruit (they ran out of shrimp ceviche) with a fresh theme. Both turned out AMAZING. A good taco starts from the outside and being able to get a soft AND hard shell ensures you don't miss out on any texture! All the ingedients were great and the two tacos were huge! My husband had to help me finish them! And to think... they were both under $5 each! Everyone enjoyed their food and the service was super friendly but not overbearing. The only reason I didn't give five stars is because our table was sticky, which was annoying as we were there. But, we will definitely be back. Super affordable, delicious, and convenient for all appetites!",4-star
"Condado has fantastic build your own tacos. There are plenty of options, including delicious vegetarian options like marinated portobello and chili tofu. I really enjoy the Sweet Lucy shell which has queso built into it. I recommend ordering the margarita of the month. It's always delicious and creative. The only downside is that this place is packed at all hours. That's because it's so great!",5-star
"Went here after a Penguins game in search of good, unique tacos. Got a dip trio, which comes with two salsas also. Highly recommend the chorizo queso, my dip of choice of the 5. For drinks, my husband got the traditional Marg and I went mango. Yum, although no salt on the rim. I'm sure you could get some if you asked, but that's usually a given for a Marg. When it came to taco time, I wanted to go with ones on the list because I often think the chef knows what meats, Vegis, and sauces pair together best for the ultimate tasty taco. Unfortunately, of the list of about 10 tacos, there was like one chicken and one beef and the rest were vegetarian or vegan friendly with no meat. I'm all for having these options, but carnivores like me want a taco with some substance. I don't know if they'd add meat to the vegan and veg options, but I opted to just create my own instead at that point. I did one with brisket and one with pulled pork. I made sure to add different Vegis, sauces, and shell choices to each so I could sample as much as I could from their list of add ons. I've gotta say, I made two pretty perfect creations. All the ingredients were fresh, my brisket one was my fav. This could be partly due to the fact that after all the dips and taco #1 I had no room for taco #2, so it went home with me and was reheated for lunch the next day. I'd def return, and it was a nice simple walk from PPG Paints for a post-game dinner. But my only suggestion would definitely be to have more suggested tacos including meats.",5-star
"This is a make your own tacos place, that also offers some pre-made tacos. Me and my friends ordered some nachos and two or three tacos each, which ended up being more than enough. If you're only getting tacos I think two or three are fine, based on how hungry you are. They're pretty big and filling. Nachos were nothing special. We had quite a lot left over but didn't box. We mostly just ate the free chips that they gave us, which were good. The tacos were also fine, but again nothing special. It kind of felt like they were going for the authentic but hip vibe with some of their ingredients, and it just didn't end up impressing me. None of the individual ingredients (and I tried to get a variety) were amazing. Just didn't live up to other tacos I've had, growing up in California. All that being said, I see the appeal for make your own tacos and nice drinks in a hip environment at a reasonable price point. Also the murals, art, and service were all awesome!",3-star
"I was in town and was craving mezcal margaritas so we came here. It's eh. Mezcal was good but even when i kept ordering different flavors, i didnt get much flavor. I didnt get to try the food except for the guac and salsa, but my bf tried the tacos. He said they were good. I did like that you can basically create your own taco.",3-star
For New Year's Eve you would expect average service and food at any bar or restaurant. Wrong. This place was awesome. The tacos were amazing and it was 11pm. Drinks were great too. Excited to come back next time I'm in Pittsburgh,5-star
"This place is SO COOL. They have a build your own taco menu, a very extensive liquor menu, & some really good looking cocktails. Whenever you order a margarita, you get to pick the tequila that goes in it! AND they have the tequilas listed by quality! There are a good amount of vegetarian options as well, which is always a plus for me. I ordered one with the Thai chili tofu & one with Portobello mushrooms. Everything was very fresh tasting & their corn tortillas were THE BEST. We also tried their Queso special which was loaded baked potato... it kind of just tasted like potato soup on chips, but it was quite pleasing. The tacos are cheap & the drinks are a decent price for being downtown. I'll definitely be back.",5-star
"Just made it here for the first time and was very impressed. The decor inside is fitting with their theme, but the overall modern layout of Tonic is still there which I like. The service was great and our server took a lot of time to explain all of the options and some of his favorites with us. We had the queso blanco and salsa verde to start. The queso might be the best I have ever had. It was a perfect level of thickness and had a great cheesy taste. The salsa was also very good. It wasn't runny like many salsas can be. The chips they use are house made and you can definitely notice a difference. I had two soft shell flour tacos as my meal. My first was the house made chorizo with cheddar and Mexican chimichurri. The flavor of the chimichurri was great and went perfect with the chorizo. My second taco was the chicken with chipotle crema. The chipotle sauce had a perfect amount of spice to it. Overall I couldn't have been happier with the food here. You can tell everything is fresh and house made which really makes a difference. Can't wait to go back.",5-star
"Love this place so much! Let me get my two negatives outta the way: 1. So effing loud! Full of woo girls 2. They don't use the Nowait app 3. Waiting area is non existent Ok now to the good stuff. The margaritas are so good! I recommend getting a pitcher to share, it's more economical. The guac and queso are killer and the homemade chips always crispy and perfectly salted. The build your own taco scheme is so simple it's genius! You cant go wrong with the shells but I would recommend hard over soft. The juices from the salsas and sauces and meats will make the floor tortilla soggy. I haven't met a meat there that wasn't good. Seriously just go. NOW!",4-star
"Hands down BEST tacos I've ever had in my life. I loved the concept, where you order your own food by using pen and paper. There are tons of options, especially for vegans and vegetarians. Drinks looked great, I ordered one but I think the server forgot to put it in. I ate so much chips and guacamole that I was kind of glad he forgot it! Wow! Check this place out.",4-star
"Condado Tacos is a great restaurant. I've gone 4 times over the past 2 weeks. It's definitely budget friendly, with really tasty suggested tacos, but my favorite is the Create your own tacos. Starting at $3, they allow you to customize your taco from shell to sauce, the whole enchilada. You can easily get away with eating in for $10-$15. The margaritas looked really good too (and cheap), but haven't yet indulged on that yet. Also - they have a loyalty card that's gets you $5 back on every $50 you spend. Happy hour takes a $1 off tacos and Margaritas, so you definitely can't go wrong (5-7PM).",5-star
What a concept - build your own tacos. And they are awesome including the quesos and salsas. Plus some great beers on tap too. This place is always busy but haven't had to wait more than 10 min for a table.,4-star
"I typically never order tacos because I'm picky as all hell, but this place lets you build your own! I met my friend here for lunch last Friday, and it wasn't even our first choice. We tried three other restaurants but they were all packed to the brim. We both mentioned Condado and said we had yet to try it so we might as well give it a try. We got seated right away and even got a seat on their patio area. I consider myself a queso connoisseur and their queso is bomb. Honestly though, the tacos were the best part. I believe I go the ju-ju shell which was essentially a hard shell nestled inside a soft shell glued together with their queso - amazing. Highly recommend.",5-star
"Spicy!!! They need a spice warning for some of these tacos! Anyway, I was a bit disappointed by my experience here. It was extremely crowded and very loud. You are either going to be crammed in downstairs, or crammed in upstairs. They don't really have menus, you use two different sheets of paper to order by checking what you want in pencil. The first sheet has ""suggested"" tacos and the other sheet is a ""create your own"". I decided to get two suggested tacos. You put your name at the top when you are done filling out your sheet. At the table they give you plastic sporks and a roll of paper towels. So messy. The cafeteria style sporks just don't work and feel really cheap to me. Can't invest in some real forks? When it was time to deliver the tacos, the waiter would announce the name and you claim your tacos from the tray. When our table got the tacos, we were all confused about who actually had the right tacos. Mine ended up having meat in it, but nobody at the table ordered meat. Apparently I did by accident. There was a spanish word in the description that I did not understand that apparently meant meat. It was a %#*^ show. The waiter returned with two new tacos, the Dutch Dragon and George's Dirty Taco. I took one bite of the dutch dragon, and my mouth turned to complete fire. It had guac, portobellos, corn, tomatoes, salsa and of course pickled jalapeños. Again, probably my fault, but they really need a spicy warning. I scarfed down the dirty taco, which seemed spicy too, but maybe it was because my mouth was burning. That one had rice, beans, cheese, onions and ""dirty sauce"". I literally don't know what that means but it was a decent taco. So, if you want absolute chaos and a night ending with sticky fingers and a burning mouth, come on down!",2-star
"This actually may be my new favorite taco spot in Pittsburgh. I just really love the vibe. The food is good and the price is right on point with what you should pay for tacos in a Downtown Pittsburgh location. There is a downstairs and upstairs, giving it plenty of space for patrons. You build your own tacos here. You fill out a form of what you want and the quantity you want. They also have a few ""house"" recommended ones on another form you can fill out. Great variety on everything from taco shells, meat, and sauces. You could make a TON of different tacos if you wanted. I had three totally different tacos. I loved them all! We also ordered an order of chips with gauc + two salsas. I think that was actually my favorite part. I lied... the pitcher of peach margaritas was my favorite part. I will be back like 1000 times.",5-star
"Condado is a great addition to what seems to be an ever-expanding taco scene in Pittsburgh. The biggest difference here from other joints is that you can completely customize your tacos. I highly recommend the Sweet Lucy from the taco shell selections! It is a soft shell, layered with cheese and then a hard shell inside...kind of like a gordita crunch for anyone that's a Taco Bell fan. The prices at Condado are also super reasonable. You only pay $3 per taco..unlike some other places in town that charge $6 or $7. They also have a great Happy Hour where tacos are $1 off!",5-star
"Finally, after hearing so much about this place I paid it a visit. The service was dynamite, wish I caught the gents name, but he was a great bartender and really attentive. The margarita is a little too sweet for my taste, but okay nonetheless. Queso with black beans was really good, extremely flavorful. Tacos... Little disappointing. I got the fried corn shell with tofu and wasn't a fan. Tofu was over fried as well as the shell. Obviously it was fresh, but one bite and the whole thing crumbled. Thankfully they give you a spork. Next was the shredded jackfruit, which was decent. I've read reviews where people have said the tacos are really packed with ingredients and totally worth the price, I didn't get that. It wasn't expensive, but they were minimally stuffed. It's a nice, hip place that downtown needed. Really glad to have it. Only downside is that there isn't a lot of room to move. I sat at the bar and had to sit like a T-Rex with my elbows shoved to my side. Oh and it's loud.",4-star
"Fun and friendly taco restaurant Downtown. So many options for customizing orders, can be overwhelming. Honestly, you can't make a bad choice! Highly recommend the flight of Margaritas!!",4-star
Very disappointed. Tortilla chips were way too greasy. Asked for hot salsa and what we got was not only mild but also quite bland. Brisket Tacos were nothing special; had much tastier ones at another place around the corner. It was their first week open so I may give it another shot... have heard some good things that don't match my experience.,2-star
"This place is trying way too hard. Born and raised in LA, I know good Mexican, and this is far from it. The queso is very similar to that of Moe's at three times the cost. Gross. The beef brisket on my taco tasted like marshmallows??? The only redeeming qualities to this meal were the salsa verde and my pomegranate margarita. The decor is...very strange. Meme-y and kind of annoying. ""TACOS 4 LYFE!!!""? Not these tacos. Won't be back for the food. Might be back for the margaritas. If you want good Mexican, walk around the block to Bakersfield.",1-star
"Went to Frys in the same area recently . . . R.I.P., Dark Horse. This place is now Fullers :( Dark Horse was one of the best Dive Bars in Chandler! Used to be a regular hangout for my friends and I on Friday nights. Karaoke, anyone? Always had a great time. My friend is a musician, and she'd come here to sing / play in 2009 when Dark Horse had open mic on Thursday nights. Nice to get local musicians some exposure. Fantastic drink specials; delicious Long Island Iced Teas and a beer on tap for everyone. Will definitely miss this place!",4-star
"The Dark Horse rises! Send out the signal Mr. Commissioner. We shall convene at the bar! Needed a dive to hangout with some friends. I decided to check this place out on a whim and let's just say I did not regret it. Good food and affordable drinks (AA Member here! Affordable Alcohol) I ordered the Rooster Burger, which came with some sport peppers on the side. I love it when my burgers have some kick to it. Grilled onions and Ortega chili a top a cheesy beef patty = yum! My mate and I ordered their bucket of beer, which only came out to $10 for 5 bottles - Shazam! I ain't talking about Shaq either! Live music on a Saturday night. It was a cover band that was rocking it! Sweetness, they dressed up like the early 90's --- big hair and waves haha yep! The place itself appears to be a sports bar. Large LCD screens and a projector screen for the main game. There was a poker game going on at the back of the bar and owners are definitely from SD - Booo! Go Chiefs! - Enjoy",4-star
"What can I say? Nothing good here at all. The wait staff seemed lost. We ordered cheese curds and they gave us a handful. Literally like 10 little pieces for 6$. Wings were ok but nothing to write home about. Very small and cluttered place. Keep driving, zipps or teakwoods would be a far better choice.",1-star
"Great sports bar. Staff is very friendly. Service is fantastic. Jason the bartender one of the best in Chandler. Owner was there during our visit and was very engaging. I didn't try the food but plan to next ime . Overall a clean, friendly neighborhood bar. Couldn't find any glaring negatives whatsoever.",5-star
"I like the wino wednesdays, the pasta bowl was delish and was quite a bit for $5, we also like Thursday for the 38 cent tacos and 2 dollar Tecates. Three tacos filled me up. The wait staff, cook and bartenders can make or break your business, I think the owner has a winning crew Tammy and Diane",5-star
"I went with my SO to this joint last week on a Thursday and I liked it! I thought it would be to dingy for me, but apparently I'm dingy girl! Happy hour til' 9 or 10 BUT reverse happy hour after 11pm. What more could you want? Had too large of a beer for $3, some kick-ass nachos ( kind of $$). Spilled cheese on myself. Don't know if it was me or the beer that caused that. But the clientele there didn't mind. Loud music, breadth of humanity, plenty of seating. Attentive staff. Actually, I think they were trying to get me drunk because they kept coming around and telling me about different drink specials. TV's with sports and goof-sports shows. In all, a great way to make for a difficult Friday at work.",4-star
"We go to DH often for NFL games. It's the best place in the area to watch several games at once....trust me, we have tried several. Food is fair, service if fair, but we will continue to go for NFL and draft beer.",4-star
Nifty little hidden sports bar with great service and great owners.. Owner Lisa is always friendly. Food is better than bar fair & atmosphere is nice. A great local bar. They even have an indoor putting green!,4-star
"What a fantastic bar. The karaoke dude is sorta...well, interesting, but hey. He lets us sing and only mildly judges us. Love the food - hello, Chicago style hot dog - and the drinks are always cold and delicious. I have a favorite football bar but the Dark Horse has specials every day, including happy hour Monday through Sunday. So go. It's fantastic. The inside is nothing fancy but the staff is warm and friendly. They do favor the regulars, but generally...regulars treat the staff better.",4-star
"Ok, let's just forget about the food cuz I only had one thing and it sucked and that's not why I went. So DH gets a free pass on that for now! The first time I went, they had the NHL draft on which I thought was awesome! (Not enough people are into hockey in my opinion!) I was with a bunch of Polar Ice guys so it was a lot of fun. But the REAL reason you go to Dark Horse is definitely for the Karaoke. It's one of the best song selections I've seen-ahem Wings and Rings down the street could maybe take a hint! Good crowd. Wide variety of ""talent"" and the MC Karaoke master is like a guy out of The Wedding Singer but you gotta love him! Service is not the best. They seem to take care of the regulars a little better. Still if you're looking for a good time on a Friday night, I highly recommend!",4-star
