Review Text,Star
"It would help if the front girl don't just sit us down and not ask us for drinks or put us with a waitress. Instead, let us just sit here for almost an hour unattended! If it's time for you to clock out then it's not our problem. But if you're gonna seat us be more professional about it at least then leave!",3-star
"One star because that's the least amount you can leave. I understand they have dollar margaritas but they should have enough people on staff to make all the food and get people seated and fed quickly. We came in restaurant seemed slow. Hostess said 10 minute wait to let the kitchen catch up. Well by the time we where seated the lobby was packed. As soon as we sat down we each ordered a water and a margarita we were a party of two. we place our order for food. That's where things went south. We sat for 45 minutes. The table that sat after us, ate and left before our appetizer ever came. I left a $5 on the table to cover margaritas. Never going back again.",1-star
"Bad time today. Dirty windows, table sticky, handy payment/menu gadget yucky. Used my fork to enter info. Food was burned and dry. Only dark chocolate desserts. Adios.",2-star
"My second visit in the last year. Both experiences were similar: awful. Tonight, we arrived after my daughter's dance recital, so around 10pm. Not too crowded, thought it would be a quick place to grab some appetizers. NOT! Our party of 6 ordered 4 appetizers (3 of which were sample size), 2 house salads, and a kids meal. 30 minutes later, one appetizer came out, said the remainder of the food would be out in about 3 minutes. 10 minutes later, a different server brought the salads out (40 minutes after were seated, just for salads!) but we had no silverware. Another 5 minutes later, 2 more appetizers and the kids meal came out and we asked for silverware. Next time the server rolled around, we again asked for silverware, and were told ""I told her to get you some,"" referring to the hostess. He called across the restaurant to the hostess, who said she didn't have any silverware. He grumbled and went to find some. Several minutes later, our last appetizer, and silverware finally arrived. So almost a full hour before we had our entire meal and utensils to eat it with. We asked about the 50% off appetizer sign on the table and the dude actually said ""you got here after 9, and that's for after 10 on the weekends."" He did finally honor the 50% off the regular appetizer when we basically had to tell him to look at the time on our ticket. . Not completely the server's fault, but the whole experience was horrible. After two very sub-par visits, my family will NEVER go back to this location.",1-star
"Absolutely awful! Took forever to get food, food then came out cold, we asked the manager to fix tv 3 times and it never got fix! The place was dead and it was still slower than molasses.",1-star
"1.wait time was 30 minutes,then we get to table, 25 more minutes till food, then the order I had was not good, had to reorder, said it would take 10 minutes but it was longer, when they bought my food I asked for a to go box, people I was with had eaten their meal... next time I will come earlier and order different food",1-star
"The food was terrible and the service was even worse. Now I know why I don't go to Applebees. My waiter needs to be re-trained on how to do his job. He took our order and that was all he did. He never came back to clean the dirty plates from our table. The first dish I ordered was horrible upon the first bite. So I waited and waited and waited until I finally had to flag down another waitress to help me. She ordered me a new dish, only to order the wrong dish. Then I asked to speak with the manager and I watched him sit at the bar for 10 minutes doing nothing before he decided to come to my table. This was the worst restaurant experience I ever had.",1-star
"Party of six for my daughters birthday. She requested to go to Applebee's, Concord Mills. I remember now why I have not been in years. Food was OK, but service was terrible. Had to ask for everything, drink refills, napkins, no salt, pepper, or ketsup on table. Had to wave down waitress for everything. I still tipped, but regrettably. Restaurants in this country now expect you to pay their waitress wages on tips. I am OK with that if they actually earned it and not automatically expect. Last time for Applebee's.",1-star
"I've been twice now in the last couple month, and both times found the service to be good. I know what to expect in an Applebee's and that's what I go for. I sat at the tables around the bar one time and in a far back booth the second time. I much enjoyed the appetizers, the meals, and desserts. As a comment to other low star reviews. My experience is probably different because I go during non peak times. Middle of the afternoon before dinner crowd or later in the evening after the rush.",4-star
"Took my family from out of town here...never again! The food was terrible. I felt sorry for our server because she was great, but the food was nasty. It's not the cleanest place and the wait time is ridiculous. I will never eat here again.",1-star
"Prices are about what you would expect for a chain restaurant. The food is always good, and the service is okay. Not spectacular. They can be a little slow, probably die to the fact they were in the back visiting with each other instead of taking care of their customers. They are clean, but it smells musty.",5-star
"After work dinner with coworker. Ordered: burger, brewhouse chicken and chocolate lava cake Not busy @5:15pm, 5-6 tables Had to wait awhile for someone to seat us Waiter was nice but seemed distracted the whole time. Forgot my lemon and then condiments for burger. Food was hot and fresh Good experience overall.",4-star
"Big mistake to go. The total number of 1 an 2 stars is staggering. Applebee's should be ashamed of this establishment. Absolutely the filthiest place I have ever eaten at. The menus were stuck together with slopped food. The wrapped silverware had hardened food on it. The tabletop computer system had food and grease all over it (not just at our table). The food was terrible. I had the spicy chicken over mac&cheese. I do not know the name, as its is not listed on any Applebee online menu. But, it's the dish on their in-house menu. Seriously Applebee's - three frozen chicken stips dipped in some kind of spicy sauce from a jar? The mac&cheese should be just called mac, no cheese flavor what-so-ever. The server was great and service was fine. It is a pity that this place just sucks as bad as it does. Heed the warnings fellow Yelpaholics!!!!!!!",1-star
"Beware. Three words to describe my experience: crappy food, desorganized, dirty. Had to wait for what? Tables were empty and I should had seen this as a sign. No greeting no nothing. This girl came took two menus and told us we had to wait for another waiter to give here the sign to ley her know were to sit us. THE WE'RE PLENTY OF EMPTY SEATS. At last seated. No water, no silverware. The waiter kept passing by and saying she was working on it. Working on what? Melting metal in the kitchen to make our forks and spoons. Very strange. All the waiters looked very sloppy like the place, dirty and crappy. Our food came after 35 mins al together appetizer and food all cold, all the food. Our soup was frig cold. Horrible. It was a 57.00 slap on the face for the most horrible, salty, cold and disgusting food I have ever been served. The owners of this place with the sister chain Red Lobster across the street should close both down. They are both disgusting. Avoid at all costs!",1-star
Im here at applebees and the server was great but i order of their new special of 3 appetizers and one of them the brisket nacho looked like someone started eating of it. I spoke to the manager and he tells me that its the way they look..... Really!!!! I dont think.... I won't come back here,1-star
Been here a few times and everything has been pretty mediocre. Decided to try again last night and service was horrendous. Server took over 15 minutes to take our drink order and told us 3 times he'd be right with us then never stopped. Our dessert was brought to the wrong table and it took over 10 minutes for our server to notice. The food was average at best and the triple chocolate meltdown tasted like a frozen and then microwaved cake with a lot of artificial chocolate syrup. Will not be coming back to this location unfortunately.,1-star
Second visit. First time long wait but plenty of open tables. This time I was seated with no waiting. The new drinks were good but my meal took forever to arrive. No forks no knives. Meal was cold. This experience was a $80 slap in the face.,1-star
"I can't believe this place!! My husband and I went here just last Saturday night. We were looking forward to it since we have two little ones and time alone is precious. We got there and I can say that I understand it's Saturday night and about 11 so I am giving them the benefit of the doubt as to the cleanliness of the floors and stuff. We thought it was cool that they have ""tablets"" on the table now so we ordered our apps with the tablet and then the server came over. ""What y'all drinking?"" Ummmm hello. How are you? Ok so two strikes by this point. Next thing I know the server, our server, is cleaning a table next to ours and she takes a broom that has probably been in the store for at least 5 years and sweeps the table top off. There was only like two straw wrappers and maybe a lemon wedge on the table. She just took that old nasty broom and swept the table top!! CHECK PLEASE. I have worked in this business since I was 14 and even then I would have never did this. Ridiculous. Called the manager and cancelled our order. If she can do this in front of us and about 5-6 other tables there is no telling what she is doing in the back when we can't see her. NEVER going here again. Disgusting.",1-star
I always sit at the bar they take better care of you. Karl and Stevie always make sure I am taken care of. WE LOVE TO STOP IN BEFORE A MOVIE ACROSS THE STREET!! Quick in and out with a smile!,5-star
Just ate at this crappy place. Food and service sucks. Will not return to this garbage trash. The waitress don't want to work for their tips. They looked pissed because it's Saturday and they Stuck working.,1-star
"Me and my roommate have been to this applebees a few times but this last time was pretty bad, We ordered the green bean chrispers, chicken tenders plate and the oriental half salad. Green bean chrispers were very over cooked as well as the chicken tenders to were i couldn't really eat them. the waitress was nice at first and then randomly she walks by sets the check on the table like i had made her mad and walked off with out a word. Made me feel like a ""get the hell out"" from here. We WERE going to order desert but after that we decided against it. Bad service over cooked food.",2-star
"Was traveling on business from Phoenix on Oct 13th (just doing expense report today ;-). Flight was late, late hotel, etc. Was the only place open but Sarah G. was our server. She was so nice. Got the order in right away, had a great personality and kept the drinks full. Best service I've ever had at an Applebees!",5-star
This place simply doesn't cut it. The food is substandard and the service is a bunch of folks running around like they have no idea what they are doing. Go someplace else . . any place else. This truly is not good food.,1-star
"Crapplebee's is right! I joined a colleague here for a quick lunch and I'll likely not make that mistake twice. The service was minimal, the restaurant was dirty and the food was horrible. My salad was filled with wilted lettuce and my water tasted funny. I could have gotten a better salad from McDonald's at half the price. Don't waste your time.",1-star
"Pretty average trip on a Friday night. No wait which was nice, or an indicator of just okay dining? Either way...our service was good, maybe overly friendly, but better that than searching for him and he was apologetic for us having to wait for our food longer than expected for a near empty section! Our appetizer was the way over greasy would never get again Potato Twisters...basically deep fried chips with a greasy dip...just yuck! I got a cheeseburger that was a little pinker than I like it but tasty overall, he got a skillet of steak, potatoes and onions that was VERY hot and sizzling everywhere...what a mess although the flavor he said was good. Not impressed at this visit, but based on previous trips I'd give them another chance...perhaps a different location...",2-star
Meh. Just passing through and stopped for a bite..place wasn't busy on a Friday dinner service which is a bad sign. Seemed dingy/ slightly dirty. My Skinny Margarita was yummy though.,2-star
We went on Canada Day. We received excellent service and wonderful food. This place is certainly one that Canada can be proud of! Our waiter recommended the smoked haddock hash with poached eggs; I'm glad I listened to him.,5-star
"Lovely bar with good classic drinks and relaxed vibe. Hung out with smoker friends so we periodically stepped out for a cigarette (for them, not me) and the bartender was always great about keeping our bar spot and covering our drinks with a coaster. From my perspective, a nice touch of service. Saw folks ordering food that smelled good as well.",5-star
"Bar George is such a beautiful place. The servers and staff are welcome, warm and friendly and the ambiance is great. It's such a special place in downtown Montreal. I've been with friends for brunch several times and it's always delicious. However, this time we noticed that the portions have been significantly reduced. Each of dishes was delicious but smaller and some didn't come with the sides of potatoes or greens like it used to. We decided to order an extra pain perdu to share. I still love this place but I was disappointed.",4-star
"Le bar George m'avait été recommandé par un maitre d'hôtel alors que je cherchais un lieu sympa et 'différent ' pour y emmener un visiteur venu d'Europe. C'était en plein hiver et on m'avait vanté le côté chaleureux, chic et totalement approprié pour un ami venu d'Ecosse. Finalement j'y suis allée pour la première fois un dimanche de printemps, non pas pour les cocktails mais pour un brunch. Le decor est grandiose, installé dans un ancien 'gentleman's club' on sent l'histoire du lieu de par le choix des peintures accrochées au mur, les coloris choisis, les grandes cheminées bourgeoises. Le decor est joli mais manque un peu de lumière naturelle, probablement que l'hiver c'est effectivement idéal. Nous avons commandé sur le menu du brunch et tout le monde a rapidement trouvé quelque chose qui le tentait. J'ai pris une assiette dejeuner avec un morceau de boudin noir. Les portions etaient correctes, suffisantes, pas extravagantes mais le plat en soit n'avait rien d'exceptionnel. Bon, mais pas au point de me dire que je veux y retourner manger un brunch parce que finalement les assiettes étaient assez dispendieuses en comparaison d'autres places à déjeuner offrant des mets similaires. Le service était très professionnel et la salle à manger très calme, ideale pour un groupe familial ou meme un couple de visite à Montréal pour le WE. Je tenterai peut-être le bar un soir car c'est pour cela que ce lieu m'avait été recommandé initialement. Plutôt l'hiver.",4-star
"Thankfully this place was not far from our stay in Montreal. We stopped in for late night cocktails and the atmosphere was great. unique drinks and friendly staff. We came back later on in the weekend for brunch which was also very good. Avocado toast with poached eggs was everything. Get the side of Toronto bacon and soak in the salty goodness! The decor of this place is quite interesting. A very historic place ringing true to its vintage look with slightly modern pieces. Cool vibe at night, but nice for brunch. Try to go if you're in the area!",5-star
"What a beautiful place to have a nice breakfast. I went with fellow yelpers to go to Bar George. The service was amazing they have a lot of staff who always made sure that I had water, coffee and tea. As well asked if I liked the food. They made some options on the menu Vegan for me. I chose the avocado toast it had a great relish under which gave it a nice taste to it. The service was also very fast from the kitchen. They have a great Americans and with the tea they have a full pot not just a cup ! They have beautiful washrooms, parking is on the street which is free on Sundays. The only downfall with the price for a tea, coffee and two avocado toast was $30 which included the tip. It wasn't horrible but a tad high. But you get your money's worth here. Check it out for a fancy occasion.",4-star
"Great ambiance and a very nice bar. The burger was over cooked and under seasoned. Definitely will come back for cocktails, will probably skip the food!",3-star
"While vacationing here in Montreal with my boyfriend we stubbled across Bar George and figured we'd give it a try. The exterior and interior are absolutely beautiful so we were excited for the experience we were about to have. The food is fresh and each plate has such a great balance of flavors. We first came for lunch and loved it so much that we made dinner reservations for the next evening. Do yourself a favor, whether it's just to stop by for a drink or have meal, you won't regret your visit to Bar George.",5-star
"Bel endroit et beau décore à l anglaise. Très bon service, Gâteau au chocolat et son sorbet vraiment délicieux à essayer absolument",4-star
"Where do I start, Bar George gives me all the feels. It's beyond exceptional. This once home of business mogul turned exquisite boutique hotel offers fine relatively affordable dining. Also learned it's a national historic site in Montreal. It's like walking into a museum. The space is absolutely breathtaking. The 4 of us were lucky to snag a spot for brunch without a reservation on a frigid day but wouldn't chance it next time. We all loved our meals: -Full English Breakfast -Haddock Hash -Eggs Benedict -Beetroot Salad (disliked beets until this dish) Just wish we had time to return for a drink at the gorgeous bar!",5-star
"Great experience tonight with my wife. Service at the bar was impeccable, same for the dinning room. Breathtaking setting, simply gorgeous. You find yourself looking at all the different details on the walls. The food was delicious. We will without a doubt be back, this is a keeper.",5-star
"My family and I went at Bar George on Christmas Day 2017 during a vacation to Montreal. I hadn't realized that Bar George was a restaurant in a hotel until we got there but don't let that deter you. Firstly, the hotel and restaurant are beautiful. When you enter there is an ornate wooden staircase which was perfect for Christmas day post dinner pictures. The entry was also beautifully decorated for the holiday. Every staff member we interacted with was friendly and very helpful, especially regarding the menu. The food was fantastic. We all started our with cocktails that were a twist on traditional English drinks. As a gin lover I really appreciated the cocktail selection. Our server suggested the scallops with blood pudding ravioli which was delicious, I would definitely recommend this dish. Everyone in our party enjoyed what they ordered for dinner and we got three desserts to share. We got the George's mess which is their play on Eton Mess, the pumpkin pie, and the whiskey chocolate cake. I had wished the George's mess had more meringue but all the desserts were rich and delightful. I would definitely recommend Bar George to visitors of a Montreal.",5-star
"Came here for brunch and it was so wonderful! We didn't have a reservation and had no problem sitting at the bar. Great service, cool atmosphere, and awesome menu. Started with a croissant and holy moly was it good. Love the little jars of jam it is served with! Got the avo toast with poached egg and it was wonderful. Boyfriend got the omelette and he was over the moon. Highly recommend and would definitely come back.",5-star
"I had heard so much about this place that I had to try it out with my foodie friends. If you love history and visiting historical places..bar George should definately be on your list. Situated on Drummond Street, this majestic home is most certainly a site for sore eyes. A handsome smiley doorman welcomes it's guests into this beautiful stone walled mansion. Stepping into the former Mount Stephen's Club is like walking back through time. Stunning hand crafted wooden walls and marble fireplaces...makes you feel like you are in a fairy tale place. What is most awesome is that they do allow guests to visit the second floor to get a glimpse of the rest of the mansion. We went for Sunday brunch and loved the whole experience. The food itself is good but it's being in the mansion that adds to the overall experience. Will definately go back to try the 5@7 at the bar area! We went on a Sunday 10am and easily found parking on the street...no parking meter fee until 1pm on Sundays. Reservations are required.",4-star
"Everything was perfect- the old fashion, welks appetizer, cod cake with the delicious little caviar. We even made time for a rich chocolate tart with ginger sorbet. Everything was spectacular and the building itself is worth a visit. I wish I would have taken photos but I couldn't stop myself from eating enough to remember.",5-star
"Came here for brunch only, so I can't tell you about the bar or dinner. First of all, you are greeted with a gorgeous Victorian building that feels incredibly classy and elegant. However, the atmosphere was pretty laid back and unpretentious. We were seated at the bar and they also had a coat check. Service was fast and friendly! We watched them make drinks as people just sat around the oval shaped bar. Tried not to stare at the people across the table :| I got the george's full English, which reminded me of my time enjoying brunches in the UK. All the components were very well done, the beans, mushrooms, bacon, eggs, tomatoes and black pudding. Everything was seasoned perfectly. I think this was the first time I've had black pudding outside of England and honestly it was more delicious. I also got to try the haddock hash, and it was excellent as well. The prices are reasonable for a typical brunch, just a little pricier (tea was $4). It was definitely worth the experience and I'll probably go back to see what other English fare they serve up! (They have chips with curry sauce!!)",5-star
"Beautiful cuisine in a beautiful place. Luc is the best server ever. I called to ask if he could serve on my family and I because I really wanted to make an impression and he totally went beyond my expectations. The food is absolutely fantastic, as good as any 5 star restaurant in Montreal, which is saying something. I loved the boudin noir canneloni/scallop/ cauliflower dish. It was so imaginative and the flavors went together so well.",5-star
"TL;DR Beautiful room, friendly service, no vegetarian options in the Bar Bites. I was responsible for picking a spot for a 4pm bite before an event for a few members of a panel I had put together at McGill University on Ending Poverty in Canada. I picked Bar George based on the reviews, location, and the fact we were able to make a reservation at such a weird hour - I know a reservation isn't necessary at 4pm on a Tuesday, but we had a Canadian Senator coming and wanted everything locked down, if only for our own anxiety. I got there a bit before my guests and was delighted by the spectacularly beautiful room and the perfect, warm service. And then I found out that, very reasonably, we were between the lunch and dinner menus and would only be able to order from the Bar Bites. There were lots of delicious sounding options, but nothing vegetarian at all - everything had fish or meat - except for the French fries, but we needed something substantial before our event! Yikes! I asked about vegetarian options, and told the waitress my concern. She said, I think I saw on your reservation you are coming with a Senator? In that case, if she needs something that's not on the menu, we'll hook her up. Which was super nice. And I'm glad to know they can accommodate powerful people.... But but but. True class and high level hospitality is treating everyone at that high level. Anyway. I ate the curried fish on crumpets, and the cheese on the Ploughman Platter and they were totally freaking delicious. I loved the service from every single person I interacted with, and as the bar started to fill up with 5a7 crowd I got the impression this could be a really fun, classy place to come for drinks if you want to feel fabulous. And the lunch and dinner menus have salads and other vegetarian options I think, so no stress. Just a moment that left me thinking about how class can determine access to healthy, sustainable options... and a Yelp review seemed an appropriate place to share. ;)",4-star
"We decided to try the restaurant attached to our hostel for breakfast. The food was very good, but the selections are a little limited. The staff were very nice and accommodating.",5-star
