Review Text,Star
"No Jive Turkey here! (Actually, I just found out that Mac's now serves an open-faced turkey sandwich, sans the gravy). Went here w/ some out-of-town friends and their kids as they passed thru the CLT heading north on ye olde I-77. Atmosphere - Sunday afternoon busy, noisy, entertaining. Service - The girl at the front was great! I arrived before my friends did and asked if there was a booth available. She worked to get me one before they arrived and was completely pleasant about meeting our needs...even gave the kids the coloring sheets and crayons. The waitress was good, although she was a little slower on the refills than I normally like...but they were busy. Food - I had the open-faced turkey sandwich and onion rings. FYI - the hush puppies, while smaller now, come free w/ your meal. The food arrived hot and my meal consisted of two slices of Texas toast w/ a large portion of white meat turkey along w/ the tasty onion rings, side sauce, and Hopping John's (beans and rice). The turkey, while a little dry was easily moistened with the four sauces that Mac's now carry. The onion rings were great as normal and the Hopping John's was decent. One observation that my friend's wife and I made was that the side sauce that comes with the o-rings tastes like Mad's signature sauce but it is thicker and more appetizing. Next time I go, I will be placing this sauce on my pork sandwich! Price - $10 Turkey Plate. Great value for the amount of turkey I received. Overall - I had a nice experience that keeps me coming back!",4-star
"One of the best, if not the best, restaurant in Cornelius. The quality of food is awesome, you will not be disappointed. Good beer selection, great atmosphere, better food.",5-star
"Really bad service and food. No wonder it's out of business. The kitchen crew absolutely sucks. Food undercooked, raw pizza dough, pepperoni raw. YUCK!!!! Was there 3 days ago and the manager Kevin was oh so very rude. Many customers say so as well. Never again!",1-star
"Been in here a handful of times, but walking across the street from my apartment to watch games and have a few, I, a 53- year- old man who didn't bring ID, was carded at an empty bar. Won't be darkening their door again.",2-star
"Found this place just east of the strip. It's a small bar that serves great pizza. My wife has a knack of finding these ""hole in the wall"" places. There are quite a few TVs around the bar. The decor really matches a modern style bar with a wide variety of spirits and beers. The prices for the pizza averaged $12.95 and the salad was around $5.95. Happy hour is 4-6 pm where all dine-in pizzas are 1/2 off. That's a deal!!!! We ate a spicy Hawaiian: ham, pineapple, jalapeños. If you spicy, you gotta eat this. The 2nd pizza was the Tuscan: chicken breast, spinach, garlic, red onion, mushrooms. Both pizzas had good portions of fresh toppings. The customer service was excellent. The waiter/bartender was very nice and personable. She checked on us regularly and also would also strike up a conversation. This is one of the best pizzas we've eaten, customer service was awesome, and good prices. What more can you ask for? This is a must visit. 5*****",5-star
Great staff..good pizza..excellent drinks ... And now they have gaming which only makes it more awesome. Oh and they have the best bloody Mary mix.,4-star
I went there for wings. I ordered the 10 to go. Got home and the cook can't count there was 8. The price with tip was $13.00. Don't waste your time here. The bartender was arrogant and the place was dead,1-star
"Wandered in here with a friend while he was in town for a convention! Since I'm new to vegas, I like to write reviews! Good and bad! The bar is very nice..I was surprised to see how classy of a joint it was! However I was extremely disappointed with the service! Some guy introduced himself as the bar manager and it all went downhill from there! The drinks are a bit overpriced, we came in during ""happy hour"", ordered a pizza and it was completely wrong! The manager had the pizza remade and it was wrong yet again!!! You think they would come a drink or something for the screw up! Also, one drink per $20 in gaming (I've never heard of this)..he failed to inform of us this ""rule"" and we got a hefty bill at the end! That explains why he was overly pressuring us to order drinks! The bar made me feel very uncomfortable! I probably wouldn't recommend it to anyone! Classy joint but the service is not classy at all..bad food, bad manager or whatever he was, bad service, and overall just a bad experience! However, there was a drunken old blonde lady that provided quite the entertainment! Only highlight of that experience...most likely won't be going back!",1-star
"Here we go again!! I live across the street. I have been here four times and order food 7. Delivery sucked! ... So now we are going to fix it. Bartenders where chicks in underwear.... We are going to fix it. Everything they say is stupid. I came in about two weeks ago late after work. The bartender was cool as hell. I came back just for him a week later??? He gone. 2 girls are gone, a cook and a partridge in a pear tree. I think whoever is telling people to hit the ""Bricks"" need to hit the bricks. I will never return. You idiots! Time for someone to run this place who knows how to run it. Please sell it to somebody for $20 and get your money back. So me and all my friends and co workers that live across the street can come back. Been open a week and you have had four people quit!! Keep up the great work!",1-star
Despite much trepidation with the location of this place. I have tried many times to LOVE it and they never fail to disappoint. Don't let the new gaming (tap tap machines) and new management fool you. They continue to be a huge disappointment. Sorry and they still have some serious problems. Still one of the best pizzas in the area but good luck with no customer service!,2-star
"What a let down. Bought the groupon after reading reviews and looking at the website. The bar itself was clean and looked nicer than what belongs in the neighborhood. We were greeted by the bartender whom we ended up feeling very sorry for by the end of our experience. Not only was she the only bartender but was the cook as well. We were soon informed that the website wasn't correct because the owner hasn't updated it. Also, many of the items on the menu weren't available because the owner hasn't been around as he just had a baby. We ordered a pizza and wings to go and a couple of bloody Mary's while we waited. The drinks were good but the bartender was working hard because of other patrons and our food order. I overheard the bartender let other patrons know that she was out of their preferred alcohol. Now the food: the ""pizza"" was a small flat bread that got cold really fast and was served in a box usually reserved for an extra large pizza. The food is mediocre at best and there are much cooler bars to hang at downtown. Sorry, I just can't recommend to anyone. The bartender was nice though, she just didn't have the tools to do her job.",2-star
My new favorite place! I visit LV every week for work and have my normal haunts. But this place just jumped to the top of the list. Ronan was a great friendly and cute bartender. Happy hour prices were great and I can t wait for them to get the gaming in house. You MUST come VISIT and STAY!,5-star
"I just ordered again using the Eat24 app, but this time I called right after to make sure it went through, and it did. My order came so fast, and was hot and DELICIOUS.",5-star
"Love this spot for delivery! They'll make any type of pizza you want...including this lobster Thermidor pizza amped up with carne asada, jalepenos, cilantro, and avocado. I like to call it the Kat Daddy...;) Pizza arrives hot and service is excellent.",5-star
"I had a groupon for a large pizza, salad and 2 drinks, all for $25! I came here on a Thursday night and was surprised to see nobody else in the bar, which was kind of a bummer. Not a single other customer (until the end of my meal when an older couple walked in), despite all the awesome reviews! But the pizza and salad were SOOOO good! Barbecue chicken pizza and Caesar salad... YUM! Good food, good service, good prices, cute bartender! Good job Midtown!",5-star
"First time ordering, and I unfortunately had a bad experience. The person on the phone told me it would be about an hour for delivery because they were backed up. I have worked at a restaurant so I understand this. After about an hour and 15 mins I patiently called to see how much longer the wait would be. The gentleman on the phone apologized and told me the order in front of us had given the wrong address, so she was delayed an additional 15 mins or so. He apologized which. Was nice, but the situation should of been nullified with more than just an apology. Another 10 mins went by and I received a call from the driver asking our location, in which she was very short and unprofessional. Another 15 mins and she finally showed up. When we playfully said to her, ""did you forget about us?"" She responded wiith, ""no. Just stupid people in front of you."" After paying her, and still tipping her an adequate 20%, I asked if my side of ranch was in the box. It wasn't. There was never an apology or so much as some way to make it up to us, like half off your next pizza. In addition, our pizza was definitely not hot by this time. Customer service could really be fine tuned. Not to mention if it takes such a long time for deliveries, they might want to consider additional delivery driver to a) nullify situations like this, and b) ease up longer delivery wait times during rush hours.",1-star
"they get 5 stars because they are as good as they get. So glad I happened to stumble upon them a month ago. took my boyfriend with his discriminating NY pizza taste buds. Even he was impressed. Pizzas was balanced with just the perfect amount of sauce, cheese, meat (for him) and veggies (for me). Had their Caesar salad which was delish!! Had such a great evening there. Relaxing in a bar with a sophisticated ambiance but no pretentiousness there. Had such a pleasant experience that I decided to throw a surprise birthday party for a friend there. Unbeknownst to me they will post photos, a playlist, video messages and a birthday message on their large screen T.V.'s for a special touch. They even let us go the extra mile and put up our balloons, flamingos, have our own cake and let us add our own touch. This all made for a very special evening and everyone loved it. I kept asking all of our guests what they thought of the food and everyone of them enjoyed the delicious pizza, salads (by the way, I highly recommend the Midtown). Kevin and Roland really hit a home run with us. Without any reservation, I recommend Midtown for a special evening. They are truly a hidden gem. I want everyone to know about them. We have a downtown here in Vegas now let's make Midtown the place to be with swanky joints like this. I also love the fact that they don't have gaming only because its refreshing and you don't think you're in Vegas when you are there. If I can recommend anything, I would recommend that they have some vegetarian appetizer options such as zucchini strips, or some type of veggie dish for us Veggies/Vegans. Other than that, give them a whirl for your next shindig. You'll be pleasantly surprise.",5-star
Lobter pizza is a joke. Hope the owner knows that his pizza maker doesn't care about his business at all. My pizza had like 5 tiny pieces of lobster. 1 on each slice.,1-star
"This spot is bullshit. They said 45 mins I waited 2 hrs, no show.unprofessional and unbelievable ! This would not fly in LA, get real people. If you're going to say 45 mins it better be 45 mins or less. Not over 2 hrs!! What a disgrace. I was going to leave a nice review but heres to you KEVIN, who took my order. f**k you AssHole! NEVER AGAIN!",1-star
The pizza these guys make is fantastic. The staff was friendly and the atmosphere nice a chill. These guys are vegan friendly which is a plus.,5-star
"Great people, great ambiance and even better food. I love how I can pick the music that plays. Makes it like my own bar, feels good here. Check this new place out, it's worth it!",5-star
"I love this bar and what it's trying to become! The owner and tenders are all extremely friendly and seem genuinely happy to see you. The drinks have great prices and the atmosphere is perfect. I know business may be a bit slow for them, but my roomies and I try to pop in at least once a week. Help give these guys a shot!!! Oh and wine Wednesday? Give that a shot! Also be sure to check out happy hour Monday- Thursday 4-7. 5 dollar specialty drinks :D",5-star
"Super cute place! My friend actually painted the designs on the outside of the building, super cute! We did not eat here we just met some friends for drinks. Hubby and I shared a bottle of Merlot and it was appropriately priced at about $20. I really love the decor in here and there tv's are hung in a fashion that watching a game would be easy. They have a ""Wine Wednesdays"" plan coming up so I will def go to that when they start it :) I will update my review the next time I go!",4-star
"This place rocks!! The minute I walked in the door to pickup my pizza, which was awesome btw, I was greeted at the door by the owner Kevin. You would have thought I was one of his long time regular customers. I was a little early and my pizza wasn't quite ready so I ordered a drink at the bar. Immediately I felt like I was back home in my regular watering hole, everyone was friendly and were glad I was there. I ended up eating my pizza there which I will have say was excellent, cooked to perfection you would have thought I was in NYC having a pizza in the Broncz. I ended up staying 3 hours and had one the best times I have ever had in Vegas. This place is a must for your place to visit while in town or if you live here you need to check it out before the line is so long you will have to wait an hour or more to be seated. I will defiantly be putting this place on my short list of places that are a must visit every time I am in town. Great job Kevin and staff keep up the great work.",5-star
"Dude, came here on Saturday night at 11:30 and it was closed, WTF? I give 2 stars because a closed bar can't defend itself and who knows, it could have been awesome?",2-star
"Midtown disappointed me. If my friends and I weren't so timid and nice we would have walked out. What they advertise online- hours and menu items- is not accurate. They didn't have fries. It didn't look like they had pastries or coffee. Numerous things we asked for that were actually on the menu were out. No beer on tap. When we ordered sliders we got one, well, slider. I do have to say that the lobster pizza was really good. My husband and I shared our slider and the pizza. It was about $20 for that and we were not full so I don't recommend sharing. The waitress was having all kinds of problems processing our transaction. I felt embarrassed that we made our friends go there with us.",2-star
Came for lunch on a Monday & had the Thai Chicken pizza. Very tasty! Appreciated the julienne vegetables & chicken and wasn't too spicy. Crust could have been a little crisper; will ask them to leave in oven a few extra minutes next time. They get a gold star for having Coke products and I got a lemon in my diet Coke without asking. Bartender was polite and efficient. I did get there a little early (11:30 am) and their meatballs weren't quite ready and I may have those next time. Overall great experience. Parking appeared to be limited; I counted about 11 - 12 spots and don't know how it would work if they were busy as there's no street parking on Desert Inn here. I'll be back!,4-star
"The moon hit my eye like a big pizza pie and it was amore after visiting this place. A hidden gem by Boulevard Mall- this is the spot for pizza. Carne Asada or Margherita Pizza are served piping hot with a side of awesome bartender. Forget Metro Pizza, Midtown is much more chic and a place for adults to dine without the hustle bustle of families with children. On Wednesdays they have half off bottles of wine! Stay tuned for future check-ins because this is my new spot for a pizza pie.",5-star
"I would give this place 3.5 stars. Came to this place because I pass it on the way to work. It looks like a cool, hip, place to hang out and it definitely seems like it should be on the strip of bars downtown. They also advertise they sell coffee, pastries 24 hours but when we went there, the pastry case wasn't set up and lit, and to my dismay the poor pastries were suffocating in saran wrap sitting in the pastry case. The interior decor was very modern and everything was new. Since it recently opened (~3weeks from when we visited), there were empty spaces on the walls where the TVs should have been. The gaming wasn't installed yet either. Service was OK. Our bartender wasn't really knowledgeable about the drinks on hand and right away we noticed they only had Guinness on tap- which happened to be out that night but we only discovered that after we ordered the Guinness. I noticed that the owner/manager was there, he helped our bartender find the wine that I had ordered because she had no clue where it was. The place we extremely lit. I would have appreciated it more if it was a little dimmer. I'm a big fan of the low light setting, because it doesn't feel like someone could watch your every move. For food, we ordered two different pizzas: 1. The Midtown- classic margarita pizza, the pizza was really good the tomatoes were giant chunks. 2. Lobster pizza was definitely a hit! It's probably the main reason I would come back here. There were chunks of tasty lobster on top (not tiny little pieces as you would expect) and for a wooping $15 the pizza was totally worth it. No where on the strip could you find a lobster pizza at that price and that tasty. I totally recommend this pizza! I'd come back in a couple of months when everything is set up a little better.",3-star
"Stopped for a quick lunch after flying into L V and used yelp for restaurant suggestions. Found Midway easily & the decor is wam & welcoming. But the staff & owner were even more wonderful, very attentive & appreciated our patronage . The sandwiches, pizza, specials were great. And we enjoyed ""trying out"" the pastries which were light & tasty. Really enjoyed the meal & you will too! Cozier than most places in in Las Vegas! Give it a try.",5-star
"so far so good! great looking place, nice bar, and the the pizza i had was awesome! i will definitely be back, especially since it is only a few blocks away.",5-star
"It's a cool little new spot that is part bar, restaurant, coffee, that is open 24 hours! So basically almost everything you need anytime of day. There is a bar and tables with very comfortable seating, think plush. The music is both jukebox or radio top 40. They plan on installing more TVs soon and in the end it would be a total of 6, making it a pretty awesome sports bar. I think they are going to make a killing once the LV convention center attendees catch wind of this place. For sure it beats the food court! (Correction, I wasn't driving so I thought we were closer to the Convention Center. It's a bit of a walk but I think worth it) Food wise, they have salads, pizzas, and some appetizers. We came from dinner so I didn't eat anything. They have a Lobster Pizza that's supposed to be their specialty... next time.",5-star
Back again great food at a reasonable price. Will be back. Wifi Great. It's Easter this time and food just as great as ever.,5-star
"Good for Lunch after Church. Gone for Lunch a couple of times here but first time going after Church. Had a few minutes to kill since they don't open till 11 am but as soon as the doors opened, we were immediately seated. Wait Staff was a bit slow at the start but not unusual just after opening but quickly improved. I ordered the Steak and Lobster Tail with Baked Potato which my wife had her Alice Springs Chicken. Both were good although the rub they use on the steak could be toned down a bit. Nice fax Aussie atmosphere but still a fun place.",4-star
"So disappointed, this is my first and last time at this location. Ordered the Bourbon Salmon and loaded baked potato. The bourbon sauce was cold teriyaki salt that made the salmon way too salty, so much so I'm sure it raised my blood pressure and the potato was dry. The sad part, while the restaurant was completely empty, the waiter didn't even bother to notice or ask why I hadn't eaten my food. Get it together outback!!!",1-star
"I highly recommend not going to eat at Outback unless you like cheap food with an expensive price. I went earlier today( had a very nice server), started out with the bread being old and stale ( I guess due to it being 3 o clock nothing was fresh). I ordered the chicken tenders, which I DO NOT recommend, they were frozen Tyson chicken tenders that I fix at my house for $5 a bag!! Also, my friend ordered the sirloin which was decent for it obviously being frozen low quality meat. Only good thing about the mean was the service and the potatoes! Not to mention the mean was $40!!",1-star
"We were in town visiting for a baby shower and staying at the Courtyard Marriot just down the street. Too tired to go out and sit down for food we decided to order curbside from Outback. After going on their mobile website (which had no prices listed so that was annoying) we ordered a 6oz steak with side salad and fries and a cobb salad with sauteed mushrooms and macaroni sides. We were quoted 25 minutes. We got there after 30 minutes and then waited another 5 minutes before anyone came out to help us. They had messed up our order on the receipt so after that was straightened out we waited another 10 minutes for our food to come out. My salad and two sides cost me $30 whereas my friend's steak cost less than $15. Since the waitress hadn't brought out our itemized receipt with our bills I asked for one. When I saw that indeed, my salad and sides cost me $30 I was extremely confused and annoyed but too tired to care at that point. Tired and hungry we went back to the hotel to eat. When I pulled out my salad it was actually smaller than the side salad given to my friend and only had shredded cheese and a little bit of bacon bits on it. How is that considered an entree sized cobb salad? I was SO annoyed I'd just paid $30 for a tiny excuse of a cobb salad. What little there was to eat also tasted so bland. What a waste. It's been years since I've been to an Outback but after this experience I doubt I'll ever go back to any Outback ever again. Also noticably lacking from our bag of food was a single utensil or napkin. I guess they expect us to eat with our fingers? I should've learned my lesson from Lethal Weapon: ""They F YOU at the drive-thru, okay? They F YOU at the drive-thru! They know you're gonna be miles away before you find out you got effed! They know you're not gonna turn around and go back, they don't care. So who gets effed? Ol' Leo Getz! Okay, sure! I don't give a F""",1-star
"Well, it's not like we were searching out some gem to eat at.... we have been to Outback hundreds of times. Tonight was just a total nightmare. We waited a good 15-20 minutes just to have a table wiped down so we could sit down. We ordered 2 appetizers, a soup and 2 salads, + a meal. Before we got 1 appetizer, we were about an hour in. Still no sign of other appetizer. Ahi Tuna appetizer was good, but incredibly small pieces for $10. About hour and a half in we got salads. My wedge ""premium salad"" was soaking wet lettuce. Literally water on the entire bottom of plate. Waiter buzzed by a few times and ensured us stuff was on the way throughout the time. Manager stopped by and was very sweet and accommodating. She said she would love to treat us to a free dessert, and if we didn't want dessert, she still wanted to look at our bill and see what she could do for us. Funny thing is, we never complained once. I guess she just knew that it was kind of a shitshow? Chicken was very tiny portion with soggy bacon and no mustard-sauce. Wife's soup ice cold by the time it came. Stale croutons on her salad. She barely ate anything as it was pretty bad, and we were tired (both nurses coming off 12 hour shifts. We decided we would opt for a dessert, but manager never came back, and thus we got charged for it, (it was also sub par). Bathroom was filthy! Not sure if they're understaffed, or we just caught them on a bad night. It was busy, but not anything crazy. For the price (about $60) I have had better meals/portions at Chilis for half the price. Kind of a bummer. About 2 hours + start to finish. Not sure we will be back to this location.",1-star
"Well, I spoke with corporate and it was awesome that they tried to reconcile the wreck of the to-go service and order we received however.. the meal was $142.32 and they're idea of reconciling was sending us a $20 gift card. Unfortunately, that was a sad attempt at regaining business from us, and I don't think at this point we'll be back.",1-star
