Review Text,Star
"Once arriving- was told by the waitress that she was ""very busy but would provide her full attention to us as soon as she could"" and took our drink order. There was a large table of 6-8 beside us and maybe 3-4 tables with people at them, it was a dead zone honestly. We ordered 2 waters, kids sweet tea, and a beer. Waitress comes back with a water, sweet tea, kids water, no beer. No big deal.. things happen. We tell her, she fixes it. Order our food (2 steaks and a kids meal) and it takes about 30 minutes to come out. Ordered the steaks medium, came wayyyy undercooked. Rest of our food was cold. Waitress never comes to check on us, doesn't fill up drinks, etc. After waiting about 10 minutes after we are done eating (and there's only one other table with people at this point) we flag down a waiter to please ask our waitress for our check. She walks in the front door with another waitress and they were outside smoking! Got our check and we were charged for the adult sweet tea we never ordered. We just paid for it to get the heck out of there... pretty pricey dinner for mediocre food and absolutely horrible service. Oh, and still didn't receive the beer.. Save some money and get better food- go to Texas Roadhouse! There's always a long wait, but it's worth it for the food and service.",2-star
"Very impressed with this place, especially after reading some of the previous reviews. Yes, the service was slow. It was race weekend and we expected this, but it gave us enough time to look over the menu, enjoy each other's company, and get caught up in Facebook.",5-star
"Ordered the large sampler platter and got a tray with mostly tortilla chips, a small bowl of spinach artichoke dip, 2 small chicken tenders, 4 small jalapeno pipes and 2 small portions of (total 8 very thin) ribs that were too tough to chew and were left unbeaten for $35! boo. Then, we waited forever for our food, only for it to be so awful, as hungry as we were, none of us could eat much of it. Awful experience.",1-star
"We were searching for a steakhouse for my boyfriend's birthday, and after seeing how long the wait was at Texas Roadhouse, we decided to give this place a shot. We were NOT disappointed. They bring you out soft, round rolls with whipped butter. They were hot, fresh, and delicious. We got the crab cakes appetizer, and although we thought they would be bigger judging by the menu picture, they were still amazing. The aioli sauce they were served with was a great complement. I was pretty impressed that you have a choice of 3 side salads- house, Caesar, or wedge. The wedge did not disappoint. It was loaded with blue cheese & bacon. My boyfriend got the Caesar, and also loved it. For our entrees, I got the Ribeye encrusted in peppercorn, and topped with creamy sauce. It was full of flavor. He got the top sirloin and also loved it. We were impressed that our steaks were cooked to the perfect temp. Our server, Shawn, was very attentive. We never had an empty drink. Overall, a great experience. $60 for 2 (no alcohol) is pretty great for a steakhouse. We will definitely be back.",4-star
"Food is ok and our waitress was not pleasant. I had the southwest grilled chicken salad... Can't really mess that up. Hubby got the brisket sandwich. I tasted it and thought it was awful, he thought it was ok. All you could taste was salt. What are you trying to cover up?! My parents steak, streamed veggies and mashed potatoes were cold.",2-star
"This place needs some work. The booths are dirty and the food leaves much to be desired. My steak and shrimp were over cooked. The lettuce in the salad was wilted, tomatoes mushy, and cucumbers frozen and thawed out. I would not recommend this place. Not worth your money or time. Service and drinks were good.",2-star
Stopped in for a drink and appetizer. After someone helped us the drink I order was wrong. Definitely was not Kettle One that I ordered. Told manager and they blew it off and did not offer anything else.,1-star
Went for lunch on a Tuesday. Not crowded but service was horribly slow. Ordered Cajon burger. It was very undercooked. Doubt I will patronize again anytime soon.,1-star
It is not often someone knows how to cook chicken and it juicy and not dry. Plain chicken with no topping or sauce. This place does it right. I expect wait at a steak place. It goes with the territory. Love this place.,5-star
Not good at all the bread was hard the salad had brown lettuce.dressing tasted terrible. Filet mignon not tender or good at all very dry sweet potato. The only reason for a star at all was the waiter was good. I wanted ribs but was advised against it by the wAiter. I will Not return to this restaurant ever!!,1-star
"The food for this franchise is great. The location is great, but unfortunately the staff here is neglectful I feel. It may have been understaffed but I don't understand why when I was there is was for Father's Day weekend so you would think a restaurant would be on the'r A game for a celebrating weekend. Our waitress was nice but she was also working the bar? I have never been to a restaurant the bartender also waited tables; typically the bartender tended to patrons at the bar with food and drink. Ittook a long time to get our drinks- water. Then when we ordered a beer it took about 7-10 minutes after our food arrived to even get the beer. Not impress with the staff and I will not return to this location.",2-star
"I really enjoyed our meal. I had the 9oz Top Sirloin with the Cheesy Jalapeno Grits and the Balsamic Brussel Sprouts. I scraped the bowl of the grits they were so good. I liked the atmosphere (but as I say in most restaurants, turn down the music). Our waiter was attentive but wasn't in our faces ever 5 seconds. That is a real plus to me since we wanted to talk. Our food came at a reasonable pace and not one thing right on top of the other. Would definitely go back.",5-star
"I wish there was a 2.5 I could mark. It wasn't bad, but it wasn't good either. It was just okay. The food was decent and so was the service, but nothing to get excited about. However there were a couple things that just made me scratch my head: I got a bowl of soup and it was brought to me with a plastic spoon. No explanation was given as to why. Soup was a little tough to enjoy with the smaller than average plastic spoon. Secondly, I received two refills on my beverage. Even though she brought my original drink with ice in it, both refills had no ice at all. When I looked around the restaurant I saw other glasses with ice, so I am not sure why... Again, no explanation. As I said before, the food and service were adequate, but when I go out to eat I am really looking for good to great. This was simply okay.",2-star
"We had a party of 8 with no waiting, lots of different items tried, chicken fried steak looked like the best, nice sized portion good looking gravy the brisket sandwich was good looking but a taste disappointment, pulled vs sliced meat could have been anything, and served with a Carolina BBQ sauce, not what I'd expect from Texas. The ribeye dip was large and tasteless, not sure where the get the meat, looks the part but no flavor to speak of. The Tuna looked great and was cooked to order with a nice mixed greens salad on the side, quite the surprise. The peppercorn ribeye was cooked to order well encrusted with cracked black pepper corns, loaded smashed potatoes were OK, again the beef looked the part but lacked taste. The bone in ribeye was the greatest disappointment, it has grill marked but is very very greasy not what you'd expect from grilled meat. Overcooked and tasyless, hardly worth the effort to complain. The toffee bread pudding was the only item worth returning for, oh well don't waste your time.",2-star
"The service was poor and the food was even worse. Our food came out all together with the exception of our daughters plate. We waited an additional 15 mins for her food so ours was cold when we finally ate. I never received my salad or some of the sides we ordered, which was fine because it was gross. My daughters steak was way over cooked. She ordered medium rare and it came out well. If you want a good steak and good service, don't stop here!",1-star
"To avoid the crowd we came here with the kids Thanksgiving evening. Staff greeted us very kindly and took care of us in a very professional manner and the food was not any less to rave about. Between the four of us we tried all different kinds of meals, ribs, ribeye, filet, salads and all of them were excellent, even the sweet tea was great. Everything fresh and flavorful. We are pretty particular about our food and this is a place we will come back to.",5-star
"We've been here several times and yet to have a bad steak. It's a step up from your local Long Horn, Roadhouse, or Outback. Staff is professional and the menu contains a bit more creativity than a blooming onion! Clean with professional service at a decent price. What more do you want. I don't understand why people bash a place for being exactly what it is marketed to be. You can't expect to go into this restaurant and get the same menu as Del Frisco's or Capital Grille and still want to show up in your shorts and sneakers and pay the prices they have. Change your shorts for some pants and put on some shoes and make reservations at one of those restaurants and pay the fine dining price. FYI, it's always a good idea if you check a menu out before you go so you don't have to be disappointed they don't offer ""your type of food""!",4-star
"We went here for lunch yesterday, the food was fine, nothing too special as my steak was a bit overdone and my husbands was under but our server was FANTASTIC so based on that I gave this place 3 stars. I have been here before and really had a fantastic meal but this time it didn't quite measure up food wise. I would however go back in hopes to experience the food we had had the first time",4-star
"Bad. That was the general experience we had at the Texas Land & Cattle. Id' give it 1.5 stars if I could, but it doesn't deserve 2. We went early on a Saturday evening. The waitress was entirely inept. She showed up late to our table after getting ""reamed out"" (her words) and everything was late. Our French Onion soup finally showed up AFTER we had our meals! she told us it's because the first order had gotten cold. Well, your job is to get our food out while it's hot. Getting our drinks was like pulling teeth. The service to the table next to us was a different waitress, but with the same results. The food wasn't much better. My ""12 oz"" ribeye was a pathetic 1/2 inch thick steak. So was my son's. The lettuce was wilted, potatoes undercooked and just most everything was pretty bland. The house special sirloin was pretty decent, but that was about it. And the soup - when we finally got it - was probably one of the worst renditions of French Onion soup that I've ever had. Overall, the food was overpriced, poorly cooked and relatively bland. This place isn't worth your time.",1-star
"My husband and I went to this establishment for the first time and had HORRIBLE SERVICE! 10 minutes after we were seated at our table, no one acknowledged we were there. None of the servers took the time to ask what we wanted to drink or stopped by our table just to say ""I'll be right with you"". I brought this to the attention of the manager, Kelsey, who said it was unacceptable and she would send a server to our table right away. We waited another 5 minutes and still no one came to our table. My husband and I were fed up with the rude service and left. It's just a coincidence that my husband and I were the only minorities in the restaurant at the time. Everyone else was being waited on. We will NEVER go back to this restaurant. I'll be sure to tell all of our friends and family to do the same. The service we experienced at this establishment isn't even worth one star!",1-star
"Food was average, beer on tap was warm, service, while friendly, was ridiculously slow for 3:30 on a Friday with 2 other tables occupied. Highlight was the fried pickle appetizer...perfectly fried with great dipping sauce. Lowlight, other than snail service, was the steak nachos, which was actually like 10 chips topped with a little cheese & a cube of steak. Burgers were average & fries were not hot. Ludicrous 30% tip added to bill! If I'm going to waste 2 hours of my life and $200 (party of 5), I better be wowed...and I wasn't.",1-star
"Just came back from TXLC. It was one of the worst dinning experience that I ever had. My wife and I actually went there quite often actually because she loved the Texas bone-in-ribeye. My mother in law was in town so we took her there and ordered the same thing. They both had the bone-in ribeye and I had the regular ribeye. However, as soon as the bone-in-ribeye came to the table, you can tell there's an unpleasant smell when it got close. They smells like they have been sit there unfrozen for a while and rotten, not fresh at all. My Ribeye came out ok. We notify our server and she took cared of it and got us two new ones, but when the new ones came to our table, one of the steak had the same problem again and I was really pissed. I mean....you have to be kidding me if this happens....not once but TWICE. The manager apologized to us again but she was not very sincere and thought we were joking. This is a terrible place in terms of food qualify and consistency. We will not go back again and I used to recommend my friends to go but please don't go anymore. Unless you are not worrying about going to hospital from food poisoning.",1-star
"It's been a long time since my last visit to a Texas Land & Cattle...and it will be a very, very long time before I return again. Knowing that a large group of us were going to meet here, I felt like a proud Texan to go somewhere with Texas in the name (I lived there for 7 years, how could I not get out without some pride?). However, this place would make Texas ashamed. The space was great and they had a room reserved for our group. It provided a great intimate setting for us! The service was good. The food was its downfall. The appetizers were average and seemed factory processed (you know, open the box type). The steak was dry, hard to chew, and salty...blah. For the price per entree, they should step up the quality. Good night out with the group, great location...not a fan of the food.",2-star
We've been regulars at Thai basil for years but recently there must have been a change in chefs because we ordered our usual and the shrimp was rubbery and the cashew sautée had absolutely no flavor even tho I ordered it hot. We reordered thinking they made a mistake and the shrimp came rubbery again and with no flavor. We walked out. We're removing this restaurant from our regular Friday night rotation. It was horrible!!!,1-star
Soooo disappointing. I've been going here for 2 years and loved their shrimp Pad Thai. Always great and lots of good shrimp. Tonight the shrimp was horrible like old and rubbery and the seasoning was not the same. Sent back the dish and it came out the same. Told the chef was new and then that the chef wasn't new. Left without eating.,2-star
"We ordered the Drunken Noodle with crispy tofu & the veggie egg rolls & had it delivered. The food was hot & scrumptious. The egg rolls were delicious & crispy. The portions were substantial, enough for two meals! Will definitely order again soon, yummy!",5-star
"My husband and I always go to thai restaurant. I love this place and definitely I recommend this place, we ordered path thai and chicken carry it was fabulous. Hope you like and enjoy your thai food if you guys are going. Soooooo gooood :) :)",5-star
"Food was really good. We had the chicken satay, red curry and ginger chicken. Service was beyond horrible. They were not busy and we waited over 30 min for our food. They barely gave us enough rice to begin with and charged us a 1.50 for more. Won't ever be going back here.",2-star
"I will NEVER return to this Thai Basil - what a scam !! Myself and my dining companion both ordered the same dish. It was fine - nothing special nothing horrible. However, once we received the bill we were charged $2.00 more for each dish. When I politely brought the issue to the manager (I guess - if she is she is HORRIBLE !!) she advised me that they have a small - tiny advisement at the bottom of the menu that prices are subject to change. Ha ha ha - you have got to be kidding me !! I advised her that they should be verbally advising their customers when there is a price change. I advised her that it was unacceptable and her reply was ""It is no big deal"". She is going to tell me what is and isn't a big deal to our pocketbook - I don't think so !! She should have eaten the $4.00 because we have not been back and will never go back. For $4.00 she has lost hundreds of dollars in future business because my dining partner was a regular guest for years at that Thai Basil- NOT a smart move !!",1-star
"Almost sure I tasted ketchup In the Pad Thai that was not spicy at a number 3. If not, it really lacked on that magical Thai balance of flavor with little to no fish sauce used. Mediocre would be a stretch for this joint that uses Romain or green leaf lettuce in its ""Fresh Roll"". No herbs. Cutting corners is easy I suppose when there is no real competition within a few miles. I could go on about the poor knife cuts and onions larger than 1.5"" chunks that eat almost raw at that size and so on, but I've vented enough.",1-star
"My family and I always come to this restaurant when we are in the mood for some good Thai food. They are awesome for ordering to go but they also provide good service in the restaurant itself. Rama's favorite and drunken noodles are our go to dishes that are ""must haves"" for us. They definitely don't go light on the spice you can order from a range of 1-5. I like spicy but a 1 is good enough for me. If you really really like spicy spicy food then go for a 5. My dad orders his as a 5 and isn't disappointed. We tried the coconut soup and it was amazing! Great flavor and exactly what we wanted. I got a jasmine tea and was not impressed, didn't have much flavor. I would stick to the traditional Thai tea in the future.",5-star
"We ordered delivery from Thai Basil and were very disappointed with the food. The lunch specials were cheap ($10 or less) but the food was greasy and in some cases tasted off. My green curry was the one dish that was okay, but the spring roll that came with it was very oily and seemed kind of old. The yellow curry was unusually yellow, even for a Thai curry, and we realized that it was because there was so much turmeric in it. The sauce was pretty bitter because of the turmeric. The pad Thai was pretty flavorless and we weren't able to eat the stirfry dishes since they just smelled a little off. Unfortunately we won't be getting food from here again. Keeping this at two stars since one out of the five orders were okay, the price is cheap, and they did actually include napkins and silverware.",2-star
This Thai Basil could very well be the best Thai in valley. The pad Thai are always on point with flavor and heat. Can't beat their lunch specials.,5-star
"I've been here few times and they never disappoint to satisfy my Thai curry cravings. Their menu is simple. You can order any dish and then choose protein including lamb, tofu, chicken, beef and shrimp. Every dish can be made to order with spice level from 1 to 5. One is very mild, while 5 is Thai spicy and believe me, it pretty spicy. Lunch entree comes with cup of soup. The entree portions are not too big or small, it's just right. Their ingredients are very fresh and most of dishes comes with generous serving of vegetables. The service can be little slow, but reasonable during busy lunch hour.",4-star
My friend and I were craving some Thai Iced Tea and Thai Curry - luckily this place was open until 9:30pm. We felt bad going relatively close to closing time but we got in around 8:40pm and tried to get out of there as fast as possible. The waitresses were nice and accommodating. The Yellow Curry was delicious! I liked their yellow Curry more than Thai Elephant Bistro's. Definitely will be back again!,5-star
"It should have been a red flag that the whole restaurant was empty. The food was awful, dry rice noodles with no flavor. The service was awful Considering we were the only ones there. I didn't eat more than one bite and not one of the staff said - is everything ok? Awful!",1-star
"In their defense, the pad see ew and the yellow curry are decent, very average. everything else we've tried was bad. and i mean real bad. greasy, over fried, and just a general poor quality. I would order to go for a pasta dish (but only because it's the only thai place near me) but wouldn't try anything else on the menu.",1-star
If I don't want to cook I can always count on Thai Basil! The coconut curry dish and bbq chicken are our favorites! My kids love when I come home with food from here. One kid loves there side order of chicken in a secret sauce and the other kid loves rice noodles in a secret sauce... No matter which chef is working both know who I am and make my kids there dishes exactly how they like it! Thank you,5-star
We were desperate to have a good Thai experience in new Scottsdale. Thai basil didn't disappoint. The pad Thai was seriously great. Washed it down with a couple of Thai ice teas and wow what a great treat! Highly recommended.,5-star
"We love the Thai food here. Small Thai restaurant with great food. We tent to get the same thing every-time, which is egg rolls or pot stickers and chicken curry and rice which we split. This is our absolute go to Thai food. Always good. We will be back.",5-star
First of all the food is good. I gave them a one star because the service is horrible. It is so slow and there are a lot of tables even available. It is not that crazy busy! My food is a little bit spicy so I ask for an ice green tea refill and takes forever!. I just bare the spice feeling on my mouth!..,1-star
"I love Thai Basil Signature, not only is the food delicious but service is always spot on. I am a sucker for good spring rolls, that thin deep fried tofu skin, the rice noodles, and veggies... and let me tell you theirs don't disappoint. Their peanut (panag) curry is yummy and I adore their pad see ew noodles! My go to local Thai joint!",5-star
"We get take out from here frequently. Favs are Pad Thai, Thai fried rice and peanut curry. It's good and does the job when we're hungry for Thai food. I like that you can specify how spicy that you want your dishes to be since I don't like spicy but the hubs does.",4-star
"This place messed up my take out order a few times now. They also "" forgot"" that I ordered Thai tea for a couple times, I had to remind them... Bad service!!!",2-star
"I think the reviews on yelp are for two different places. This is for the location on Hayden and pinnacle peak. We ordered 7 dishes and the food just kept getting better. Amazing pho won ton soup, curry noodles, drunken noodles, chicken satay and the pot stickers. This place is really really good. I have no idea how others have rated this low. It really deserves 5 stars.",5-star
"Found this gem on Yelp and absolutely love it. We love the ""Drunken"" Noodles and Coconut Soup. They are a couple of our favorite dishes and have always been pretty consistent in taste. Dine in or take out! The staff is extremely attentive and very nice. We have recommended this restaurant to our friends and will continue to come back.",4-star
"Been here a couple times and it continues to satisfy me. If the portions were a little bigger, it would be more of a common place to go to.",4-star
"I've been eating my way through the menu here and so far I've been impressed with the consistency of the food, freshness of ingredients and general level of service. Heat levels are hard to come by, Thai hot is not the adventure it is at other eateries but at least there is something there. Lunch portion wise it's almost not enough, in relation to the two I used to frequent in Scottsdale it's not that it's tiny just seems off for the area.",4-star
"Service was OK, nothing exceptional. Price was fair, food good, ambiance relaxing. I will be back again when I'm in the area.",4-star
"Best place to eat Thai in AZ! My favorites are Pad Thai, Nam Sad, Tom Kah, and Pad Broccoli. The place is about 1100 sq feet but has a cool relaxed feel and if you want, you can order in advance and just pick it up-no delivery.",5-star
Very nice people. Good service. Drunken noodles spiced 2+ on a scale of 1 to 3 were great. Very fresh ingredients. Tasty crab puffs. My wife enjoyed chicken noodles. The sticky rice served too early and rates 1star. Overall a place I will happily return to.,4-star
I always get the same meal and enjoy it every time. I always get the Pha Nang (Spelling?) I always add the spiced diced peppors for that special flavor served from a side tray.,3-star
"Thanks to reading the other posts we were already prepared for less than stellar service but to be honest..good food trumps bad service any day. WE were NOT disappointed! Food was great and although it was tamed down a little too much for my liking (Spicy levels), we were able to juice it up with the proper sauce tray that had chili paste and chile oil. Service was a little slow and disorganized but our server and others there were VERY friendly and went out of their way to make sure that we enjoyed our meal. We will be going back soon...especially since our waitress informed us that they will be adding a sushi bar in the next few weeks! Obviously going a little off the ""thai food"" route but who doesn' t like sushi?!",5-star
